{
  "schemaVersion": 1,
  "journeyKey": "gj-3",
  "stepKey": "view-guardian-continuity",
  "surfaceKey": "guardian_nurture_chat",
  "actor": { "participantId": "syn-guardian-ada", "actorRole": "guardian" },
  "surfaceState": "ready",
  "careItems": [
    {
      "itemRef": "syn-gj3-item-aster",
      "enrollmentRef": "syn-enrollment-c1-ia",
      "acknowledgementState": "acknowledged",
      "responseState": "responded",
      "lifecycle": "active",
      "attentionState": "resolved",
      "messages": [{ "kind": "source_question" }, { "kind": "caregiver_reply" }]
    },
    {
      "itemRef": "syn-gj3-item-birch",
      "enrollmentRef": "syn-enrollment-c1-ib",
      "acknowledgementState": "acknowledged",
      "responseState": "responded",
      "lifecycle": "active",
      "attentionState": "resolved",
      "messages": [{ "kind": "source_question" }, { "kind": "caregiver_reply" }]
    }
  ],
  "writeActionKeys": [
    "submit_family_care_question",
    "withdraw_family_care_request",
    "correct_family_care_message",
    "redact_family_care_message"
  ]
}
